{
  "$schema": "https://json-schema.org/draft/2020-12/schema",
  "$id": "https://linnnns248.github.io/search-for-job/schemas/official-sites.schema.json",
  "title": "Official careers site configuration",
  "type": "object",
  "required": ["schemaVersion", "collection", "publicationPolicy", "sources"],
  "properties": {
    "schemaVersion": { "const": 1 },
    "onboardingPolicy": {
      "type": "object",
      "required": ["deferredSourceIds", "deferredReason"],
      "properties": {
        "deferredSourceIds": {
          "type": "array",
          "uniqueItems": true,
          "items": { "type": "string", "pattern": "^[a-z0-9][a-z0-9-]*$" }
        },
        "deferredReason": { "type": "string", "minLength": 1 },
        "processingStrategy": { "const": "company-size-descending" },
        "processingReason": { "type": "string", "minLength": 1 }
      },
      "additionalProperties": false
    },
    "collection": {
      "type": "object",
      "required": ["requestTimeoutMs", "maximumResponseBytes", "minimumDelayMs", "maximumDelayMs", "maximumDetailsPerSource"],
      "properties": {
        "requestTimeoutMs": { "type": "integer", "minimum": 1000 },
        "maximumResponseBytes": { "type": "integer", "minimum": 1024 },
        "minimumDelayMs": { "type": "integer", "minimum": 1000 },
        "maximumDelayMs": { "type": "integer", "minimum": 1000 },
        "maximumDetailsPerSource": { "type": "integer", "minimum": 1 }
      },
      "additionalProperties": false
    },
    "publicationPolicy": {
      "type": "object",
      "required": ["allowUndisclosedSalary", "allowUndisclosedEducation", "allowUndisclosedEmploymentType"],
      "properties": {
        "allowUndisclosedSalary": { "type": "boolean" },
        "allowUndisclosedEducation": { "type": "boolean" },
        "allowUndisclosedEmploymentType": { "type": "boolean" }
      },
      "additionalProperties": false
    },
    "sources": {
      "type": "array",
      "items": {
        "type": "object",
        "required": [
          "id",
          "company",
          "careersUrl",
          "focusAreas",
          "companySize",
          "companySizeMin",
          "adapter",
          "enabled",
          "checkStatus"
        ],
        "properties": {
          "id": { "type": "string", "pattern": "^[a-z0-9][a-z0-9-]*$" },
          "company": { "type": "string", "minLength": 1 },
          "careersUrl": { "type": "string", "format": "uri", "pattern": "^https://" },
          "focusAreas": { "type": "array", "items": { "type": "string" } },
          "companySize": { "type": ["string", "null"] },
          "companySizeMin": { "type": ["integer", "null"], "minimum": 0 },
          "companySizeEvidenceUrl": { "type": "string", "format": "uri", "pattern": "^https://" },
          "adapter": { "enum": ["json-ld", "selector", "cloudview", "moka", "zhiye", "zhiye-classic", "tencent", "meituan", "baidu", "huawei", "didi", "oppo", "tongcheng", "custom", "pending"] },
          "selectors": {
            "type": "object",
            "required": ["card", "title", "url"],
            "properties": {
              "card": { "type": "string", "minLength": 1 },
              "title": { "type": "string", "minLength": 1 },
              "url": { "type": "string", "minLength": 1 },
              "company": { "type": "string" },
              "city": { "type": "string" },
              "description": { "type": "string" },
              "salary": { "type": "string" },
              "education": { "type": "string" },
              "employmentType": { "type": "string" },
              "urlAttribute": { "type": "string" }
            },
            "additionalProperties": false
          },
          "zhiye": {
            "type": "object",
            "required": ["category", "pageSize", "maximumPagesPerKeyword"],
            "properties": {
              "category": { "enum": ["1", "2"] },
              "pageSize": { "type": "integer", "minimum": 1, "maximum": 100 },
              "maximumPagesPerKeyword": { "type": "integer", "minimum": 1, "maximum": 50 }
            },
            "additionalProperties": false
          },
          "zhiyeClassic": {
            "type": "object",
            "required": ["cityCodes", "employmentType", "maximumPagesPerKeyword"],
            "properties": {
              "cityCodes": {
                "type": "object",
                "minProperties": 1,
                "additionalProperties": { "type": "string", "minLength": 1 }
              },
              "employmentType": { "enum": ["full-time", "part-time"] },
              "maximumPagesPerKeyword": { "type": "integer", "minimum": 1, "maximum": 50 }
            },
            "additionalProperties": false
          },
          "tencent": {
            "type": "object",
            "required": ["cityIds", "recruitmentTypeId", "employmentType", "pageSize", "maximumPagesPerKeyword"],
            "properties": {
              "cityIds": {
                "type": "object",
                "minProperties": 1,
                "additionalProperties": { "type": "integer" }
              },
              "recruitmentTypeId": { "type": "integer" },
              "employmentType": { "enum": ["full-time", "part-time"] },
              "pageSize": { "type": "integer", "minimum": 1, "maximum": 100 },
              "maximumPagesPerKeyword": { "type": "integer", "minimum": 1, "maximum": 50 }
            },
            "additionalProperties": false
          },
          "meituan": {
            "type": "object",
            "required": ["cityCodes", "jobTypeCode", "employmentType", "pageSize", "maximumPagesPerKeyword"],
            "properties": {
              "cityCodes": {
                "type": "object",
                "minProperties": 1,
                "additionalProperties": { "type": "string", "minLength": 1 }
              },
              "jobTypeCode": { "type": "string", "minLength": 1 },
              "employmentType": { "enum": ["full-time", "part-time"] },
              "pageSize": { "type": "integer", "minimum": 1, "maximum": 100 },
              "maximumPagesPerKeyword": { "type": "integer", "minimum": 1, "maximum": 50 }
            },
            "additionalProperties": false
          },
          "baidu": {
            "type": "object",
            "required": ["cityCodes", "postTypeCode", "recruitType", "employmentType", "pageSize", "maximumPagesPerKeyword"],
            "properties": {
              "cityCodes": {
                "type": "object",
                "minProperties": 1,
                "additionalProperties": { "type": "string", "minLength": 1 }
              },
              "postTypeCode": { "type": "string", "minLength": 1 },
              "recruitType": { "const": "SOCIAL" },
              "employmentType": { "enum": ["full-time", "part-time"] },
              "pageSize": { "type": "integer", "minimum": 1, "maximum": 10 },
              "maximumPagesPerKeyword": { "type": "integer", "minimum": 1, "maximum": 50 }
            },
            "additionalProperties": false
          },
          "huawei": {
            "type": "object",
            "required": ["employmentType", "pageSize", "maximumPagesPerKeyword"],
            "properties": {
              "employmentType": { "enum": ["full-time", "part-time"] },
              "pageSize": { "type": "integer", "minimum": 1, "maximum": 20 },
              "maximumPagesPerKeyword": { "type": "integer", "minimum": 1, "maximum": 50 }
            },
            "additionalProperties": false
          },
          "didi": {
            "type": "object",
            "required": ["cityNames", "employmentType", "pageSize", "maximumPagesPerCity"],
            "properties": {
              "cityNames": {
                "type": "object",
                "minProperties": 1,
                "additionalProperties": { "type": "string", "minLength": 1 }
              },
              "employmentType": { "enum": ["full-time", "part-time"] },
              "pageSize": { "type": "integer", "minimum": 1, "maximum": 100 },
              "maximumPagesPerCity": { "type": "integer", "minimum": 1, "maximum": 50 }
            },
            "additionalProperties": false
          },
          "oppo": {
            "type": "object",
            "required": ["cityCodes", "recruitType", "employmentType", "pageSize", "maximumPagesPerCity"],
            "properties": {
              "cityCodes": {
                "type": "object",
                "minProperties": 1,
                "additionalProperties": { "type": "string", "minLength": 1 }
              },
              "recruitType": { "const": "SOCIAL-RECRUITMENT" },
              "employmentType": { "enum": ["full-time", "part-time"] },
              "pageSize": { "type": "integer", "minimum": 1, "maximum": 50 },
              "maximumPagesPerCity": { "type": "integer", "minimum": 1, "maximum": 50 }
            },
            "additionalProperties": false
          },
          "tongcheng": {
            "type": "object",
            "required": ["companyId", "cityIds", "queryType", "regularEmploymentTypeCode", "employmentType", "pageSize", "maximumPagesPerCity"],
            "properties": {
              "companyId": { "type": "string", "minLength": 1 },
              "cityIds": {
                "type": "object",
                "minProperties": 1,
                "additionalProperties": { "type": "string", "minLength": 1 }
              },
              "queryType": { "const": 4 },
              "regularEmploymentTypeCode": { "const": "REGULAR" },
              "employmentType": { "enum": ["full-time", "part-time"] },
              "pageSize": { "type": "integer", "minimum": 1, "maximum": 100 },
              "maximumPagesPerCity": { "type": "integer", "minimum": 1, "maximum": 50 }
            },
            "additionalProperties": false
          },
          "enabled": { "type": "boolean" },
          "checkStatus": { "enum": ["reachable", "needs-browser", "unavailable", "pending"] },
          "notes": { "type": "string" }
        },
        "additionalProperties": false
      }
    }
  },
  "additionalProperties": false
}
