{
  "schemaVersion": 1,
  "onboardingPolicy": {
    "deferredSourceIds": [
      "ubisoft-chengdu",
      "perfect-world-games",
      "xishanju",
      "duoyi",
      "star-union",
      "peakx-games",
      "windplay",
      "pitaya",
      "tap4fun"
    ],
    "deferredReason": "用户确认纯游戏类公司暂缓录入，优先接入非游戏公司官网。腾讯等综合公司不在此列，仍只发布符合统一条件的产品方向岗位。"
  },
  "collection": {
    "requestTimeoutMs": 30000,
    "maximumResponseBytes": 2097152,
    "minimumDelayMs": 2500,
    "maximumDelayMs": 5000,
    "maximumDetailsPerSource": 100
  },
  "publicationPolicy": {
    "allowUndisclosedSalary": true,
    "allowUndisclosedEducation": false,
    "allowUndisclosedEmploymentType": false
  },
  "sources": [
    {
      "id": "ubisoft-chengdu",
      "company": "育碧成都 Ubisoft Chengdu",
      "careersUrl": "https://zh-cn.ubisoft.com/company/career_result?loc=5101",
      "focusAreas": ["游戏产品"],
      "companySize": null,
      "companySizeMin": null,
      "adapter": "selector",
      "enabled": false,
      "checkStatus": "reachable"
    },
    {
      "id": "perfect-world-games",
      "company": "完美世界",
      "careersUrl": "https://jobs.games.wanmei.com/",
      "focusAreas": ["游戏产品"],
      "companySize": null,
      "companySizeMin": null,
      "adapter": "custom",
      "enabled": false,
      "checkStatus": "needs-browser"
    },
    {
      "id": "xishanju",
      "company": "西山居",
      "careersUrl": "https://hr.xishanju.com/society-job.html?typeId=5&zoneId=4",
      "focusAreas": ["游戏产品"],
      "companySize": null,
      "companySizeMin": null,
      "adapter": "selector",
      "enabled": false,
      "checkStatus": "reachable"
    },
    {
      "id": "duoyi",
      "company": "多益网络",
      "careersUrl": "https://xz.duoyi.com/v40/?from=banner",
      "focusAreas": ["游戏产品"],
      "companySize": null,
      "companySizeMin": null,
      "adapter": "custom",
      "enabled": false,
      "checkStatus": "needs-browser"
    },
    {
      "id": "star-union",
      "company": "星合互娱 Star Union",
      "careersUrl": "https://www.staruniongame.com/cn",
      "focusAreas": ["游戏产品"],
      "companySize": null,
      "companySizeMin": null,
      "adapter": "custom",
      "enabled": false,
      "checkStatus": "needs-browser"
    },
    {
      "id": "peakx-games",
      "company": "PeakX Games",
      "careersUrl": "https://www.peakxgames.com/join.html",
      "focusAreas": ["游戏产品"],
      "companySize": null,
      "companySizeMin": null,
      "adapter": "selector",
      "enabled": false,
      "checkStatus": "reachable"
    },
    {
      "id": "windplay",
      "company": "风际游戏",
      "careersUrl": "https://www.windplay.cn/",
      "focusAreas": ["游戏产品"],
      "companySize": null,
      "companySizeMin": null,
      "adapter": "pending",
      "enabled": false,
      "checkStatus": "unavailable"
    },
    {
      "id": "pitaya",
      "company": "火龙果互娱",
      "careersUrl": "https://pitaya.net.cn/",
      "focusAreas": ["游戏产品"],
      "companySize": null,
      "companySizeMin": null,
      "adapter": "pending",
      "enabled": false,
      "checkStatus": "unavailable"
    },
    {
      "id": "cloudview",
      "company": "云览科技",
      "careersUrl": "https://cloudview-inc.com/join/jobs",
      "focusAreas": ["音乐", "小说", "广告", "浏览器", "AI产品"],
      "companySize": "100-499人",
      "companySizeMin": 100,
      "companySizeEvidenceUrl": "https://www.zhipin.com/job_detail/7f7bc6524c7f57130nJ43Ny-GVFQ.html",
      "adapter": "cloudview",
      "enabled": false,
      "checkStatus": "reachable",
      "notes": "公司规模来自当前 Boss 公开岗位页。官网详情 URL 当前重复返回同一正文，修复前禁止启用。"
    },
    {
      "id": "baicizhan",
      "company": "百词斩",
      "careersUrl": "https://join.baicizhan.com/",
      "focusAreas": ["在线教育", "内容", "学习工具"],
      "companySize": null,
      "companySizeMin": null,
      "adapter": "moka",
      "enabled": false,
      "checkStatus": "reachable",
      "notes": "官网职位入口跳转至 Moka。"
    },
    {
      "id": "camera360",
      "company": "Camera360",
      "careersUrl": "https://hr.camera360.com/recruitment.html?channel=social",
      "focusAreas": ["影像", "修图", "海外工具产品"],
      "companySize": null,
      "companySizeMin": null,
      "adapter": "custom",
      "enabled": false,
      "checkStatus": "needs-browser"
    },
    {
      "id": "tap4fun",
      "company": "Tap4Fun",
      "careersUrl": "https://tap4fun.com/join-us",
      "focusAreas": ["游戏产品", "发行", "运营", "策划"],
      "companySize": null,
      "companySizeMin": null,
      "adapter": "custom",
      "enabled": false,
      "checkStatus": "needs-browser"
    },
    {
      "id": "xiaoduo",
      "company": "晓多科技",
      "careersUrl": "https://xiaoduoai.zhiye.com/Social",
      "focusAreas": ["电商客服AI", "智能客服", "企业服务产品"],
      "companySize": "400余人",
      "companySizeMin": 400,
      "companySizeEvidenceUrl": "https://news.ifeng.com/c/8k58TY7mu7Z",
      "adapter": "zhiye-classic",
      "zhiyeClassic": {
        "cityCodes": {
          "成都": "5101"
        },
        "employmentType": "full-time",
        "maximumPagesPerKeyword": 3
      },
      "enabled": true,
      "checkStatus": "reachable",
      "notes": "公司规模依据公开报道中的在岗 400 余人；使用北森 / Zhiye 社招公开接口采集，仍执行统一条件过滤。"
    },
    {
      "id": "vantron",
      "company": "万创科技 Vantron",
      "careersUrl": "https://www.vantrontech.com.cn/us/join",
      "focusAreas": ["物联网", "嵌入式", "软硬件产品"],
      "companySize": "280人",
      "companySizeMin": 280,
      "companySizeEvidenceUrl": "https://pdf.dfcfw.com/pdf/H2_AN202302091582948585_1.pdf",
      "adapter": "selector",
      "enabled": false,
      "checkStatus": "reachable",
      "notes": "官网当前有售前产品经理且明确本科及以上，但职位页未披露工作城市和全职/兼职属性；补齐可验证字段前保持关闭。"
    },
    {
      "id": "gislife",
      "company": "空间座标 GISLife",
      "careersUrl": "https://www.gislife.com.cn/job",
      "focusAreas": ["GIS", "数字城市", "行业软件"],
      "companySize": null,
      "companySizeMin": null,
      "adapter": "pending",
      "enabled": false,
      "checkStatus": "unavailable"
    },
    {
      "id": "qnzs",
      "company": "青牛智胜",
      "careersUrl": "https://www.qnzsai.com/join/",
      "focusAreas": ["AI", "数据智能", "企业服务产品"],
      "companySize": null,
      "companySizeMin": null,
      "adapter": "selector",
      "enabled": false,
      "checkStatus": "reachable",
      "notes": "官网当前列出成都产品经理，但未公开岗位职责、学历、求职类型和可核验的公司人数；字段补齐前保持关闭。"
    },
    {
      "id": "pzeda",
      "company": "派兹互连 PZEDA",
      "careersUrl": "https://www.pzeda.com/about/joinUs",
      "focusAreas": ["AI", "工业软件", "芯片设计工具"],
      "companySize": null,
      "companySizeMin": null,
      "adapter": "custom",
      "enabled": false,
      "checkStatus": "needs-browser"
    },
    {
      "id": "cosmic-dawn",
      "company": "宇宙黎明",
      "careersUrl": "https://www.cosmicdawnai.com/jobs.html",
      "focusAreas": ["AI原生产品", "大模型应用"],
      "companySize": null,
      "companySizeMin": null,
      "adapter": "selector",
      "enabled": false,
      "checkStatus": "reachable"
    },
    {
      "id": "xwbank",
      "company": "新网银行",
      "careersUrl": "https://app.mokahr.com/campus-recruitment/xwbank/4246?locale=zh-CN#/navigation",
      "focusAreas": ["互联网银行", "信贷", "金融科技"],
      "companySize": null,
      "companySizeMin": null,
      "adapter": "moka",
      "enabled": false,
      "checkStatus": "needs-browser"
    },
    {
      "id": "xinchao",
      "company": "新潮传媒",
      "careersUrl": "https://app-tc.mokahr.com/campus-recruitment/xinchao/16002",
      "focusAreas": ["数字广告", "商业化", "营销科技"],
      "companySize": null,
      "companySizeMin": null,
      "adapter": "moka",
      "enabled": false,
      "checkStatus": "needs-browser"
    },
    {
      "id": "naver-china",
      "company": "NAVER China",
      "careersUrl": "https://www.navercorp.com.cn/",
      "focusAreas": ["搜索", "内容", "AI", "国际化产品研发"],
      "companySize": null,
      "companySizeMin": null,
      "adapter": "pending",
      "enabled": false,
      "checkStatus": "unavailable"
    },
    {
      "id": "zhunda",
      "company": "四川准达",
      "careersUrl": "https://www.zhunda.com/recruit/",
      "focusAreas": ["通信", "ICT", "数字化解决方案"],
      "companySize": null,
      "companySizeMin": null,
      "adapter": "selector",
      "enabled": false,
      "checkStatus": "reachable"
    },
    {
      "id": "scairi",
      "company": "四川人工智能研究院",
      "careersUrl": "https://www.scairi.com.cn/join.html",
      "focusAreas": ["AI平台", "产业AI", "科研产品化"],
      "companySize": "20-99人",
      "companySizeMin": 20,
      "companySizeEvidenceUrl": "https://m.zhipin.com/companys/9c7511654096691c1HN92t65F1Q~.html",
      "adapter": "selector",
      "enabled": false,
      "checkStatus": "reachable",
      "notes": "公开公司页标注规模为 20-99 人，低于当前 100 人门槛，因此不启用。"
    },
    {
      "id": "xgimi",
      "company": "极米科技",
      "careersUrl": "https://campus.xgimi.com/campus-recruitment/xgimi/5463/",
      "focusAreas": ["智能硬件", "内容系统", "IoT产品"],
      "companySize": null,
      "companySizeMin": null,
      "adapter": "moka",
      "enabled": false,
      "checkStatus": "needs-browser",
      "notes": "用户提示该页面可能已经关停，需要人工复核。"
    },
    {
      "id": "tencent",
      "company": "腾讯",
      "careersUrl": "https://careers.tencent.com/search.html?keyword=%E4%BA%A7%E5%93%81%E7%BB%8F%E7%90%86&query=ci_8",
      "focusAreas": ["游戏产品", "产品运营", "云与产业互联网"],
      "companySize": "10000人以上",
      "companySizeMin": 10000,
      "companySizeEvidenceUrl": "https://static.www.tencent.com/uploads/2026/04/09/f6dbd30b3d8ca9c65f76f3d73b7da739.pdf",
      "adapter": "tencent",
      "tencent": {
        "cityIds": {
          "成都": 8
        },
        "recruitmentTypeId": 1,
        "employmentType": "full-time",
        "pageSize": 20,
        "maximumPagesPerKeyword": 5
      },
      "enabled": true,
      "checkStatus": "reachable",
      "notes": "公司规模来自腾讯 2025 年 ESG 报告；社会招聘岗位通过腾讯公开招聘接口按城市和目标岗位名分页采集。"
    },
    {
      "id": "bytedance",
      "company": "字节跳动",